{
  "id": "actinic-keratosis",
  "category": "cancer",
  "demographics": {
    "age": 74,
    "sex": "M",
    "pregnancyRelevant": false,
    "context": "geriatric"
  },
  "chiefComplaint": "A rough spot on the back of the hand keeps catching on clothing.",
  "lesionSite": "Dorsal hand",
  "hiddenDiagnosis": "Actinic keratosis",
  "urgency": "high",
  "historyAnswers": {
    "Onset and duration": "The change began gradually over several weeks.",
    "Itch versus pain": "Mild tenderness when rubbed; no spontaneous or disproportionate pain.",
    "New medications": "No new medication in the past two months.",
    "Sun exposure and tanning": "Long-term outdoor work with substantial cumulative ultraviolet exposure; no tanning-bed use.",
    "Personal and family skin cancer history": "No personal skin cancer; family history reviewed.",
    "Immunosuppression": "No known immunosuppression.",
    "Prior treatments": "Over-the-counter moisturizer gave little relief.",
    "Occupation and hobbies": "No clear occupational exposure identified.",
    "Pregnancy and contraception status": "Pregnancy possibility and goals should be reviewed before teratogenic therapies.",
    "Systemic symptoms": "No fever, weight loss, or systemic symptoms.",
    "Focused clue": "Over years of outdoor work, multiple rough spots have appeared on the backs of the hands; one remains rough after moisturizer."
  },
  "examFindings": {
    "General appearance": "Fictional teaching patient; assess vital signs and overall appearance in real practice.",
    "Focused lesion exam": "Several gritty erythematous papules with adherent scale and focal crust on chronically sun-exposed dorsal hand and wrist.",
    "Full skin exam": "Assess distribution and extent beyond the pictured site; no fever, weight loss, or systemic symptoms.",
    "Mucosal exam": "No additional abnormality found on this maneuver.",
    "Nails and hair": "No additional abnormality found on this maneuver.",
    "Lymph nodes": "No palpable regional lymphadenopathy; assess by site and risk.",
    "Nikolsky sign": "No additional abnormality found on this maneuver.",
    "Wood lamp": "No additional abnormality found on this maneuver.",
    "Dermoscopy": "No additional abnormality found on this maneuver."
  },
  "image": {
    "file": "actinic-keratosis.jpg",
    "status": "real",
    "alt": "Independent teaching photograph, not the fictional patient’s record: Several gritty erythematous papules with adherent scale and focal crust on chronically sun-exposed dorsal hand and wrist.",
    "credit": "User-supplied teaching image; permission confirmed by the user."
  },
  "imageStatus": "real",
  "correctMorphology": [
    "Papule",
    "Scale"
  ],
  "acceptableDifferential": [
    "Actinic keratosis",
    "cutaneous squamous cell carcinoma",
    "seborrheic keratosis"
  ],
  "tests": [
    {
      "name": "Dermoscopy",
      "result": "No additional abnormality found on this maneuver.",
      "minutes": 4,
      "indicated": true
    },
    {
      "name": "Punch biopsy with H&E",
      "result": "Histopathology supports the hidden diagnosis when properly sampled.",
      "minutes": 18,
      "indicated": true
    },
    {
      "name": "KOH prep",
      "result": "No fungal elements seen.",
      "minutes": 8,
      "indicated": false
    },
    {
      "name": "CBC and CMP",
      "result": "Results should be interpreted with clinical context.",
      "minutes": 12,
      "indicated": false
    },
    {
      "name": "Photo documentation",
      "result": "Baseline clinical photograph recorded with consent.",
      "minutes": 3,
      "indicated": true
    }
  ],
  "acceptableTreatments": [
    {
      "name": "cryotherapy",
      "reason": "cryotherapy or field therapy; biopsy if thick, tender, or indurated"
    }
  ],
  "unacceptableTreatments": [
    {
      "name": "High-potency topical corticosteroid on face or folds",
      "reason": "Site-related atrophy risk; choose site-appropriate treatment."
    },
    {
      "name": "Systemic corticosteroid for an undifferentiated rash",
      "reason": "May obscure diagnosis and worsen some infections."
    },
    {
      "name": "Methotrexate without baseline assessment",
      "reason": "Requires screening, labs, pregnancy precautions, and specialist oversight."
    },
    {
      "name": "Biologic therapy without infection screening",
      "reason": "Requires appropriate screening and specialist plan."
    },
    {
      "name": "Spironolactone without pregnancy and contraindication review",
      "reason": "Review pregnancy goals, relevant contraindications, and monitoring before use."
    },
    {
      "name": "Isotretinoin without pregnancy prevention steps when applicable",
      "reason": "Major teratogenic risk; follow current prescribing safeguards."
    }
  ],
  "idealDisposition": "discharge",
  "teachingPearl": "Sun-exposed rough scale may represent actinic keratosis; biopsy a lesion that is thick, tender, indurated, or growing.",
  "traps": [
    "Anchoring on morphology without asking about timing",
    "Using a potent topical steroid on thin or intertriginous skin",
    "Missing medication timing or mucosal symptoms",
    "Ordering biopsy without a decision-changing question"
  ],
  "needsReview": true,
  "urgentReason": null
}
