{
  "id": "tinea-corporis",
  "category": "common",
  "demographics": {
    "age": 29,
    "sex": "F",
    "pregnancyRelevant": true,
    "context": "pregnant"
  },
  "chiefComplaint": "An enlarging scaly ring-shaped patch has a clearer center.",
  "lesionSite": "Trunk and extremities",
  "hiddenDiagnosis": "Tinea corporis",
  "urgency": "routine",
  "historyAnswers": {
    "Onset and duration": "The change began gradually over several weeks.",
    "Itch versus pain": "Itchy rather than painful.",
    "New medications": "No new medication in the past two months.",
    "Sun exposure and tanning": "Outdoor exposure is intermittent; no tanning bed use.",
    "Personal and family skin cancer history": "No personal skin cancer; family history reviewed.",
    "Immunosuppression": "No known immunosuppression.",
    "Prior treatments": "Over-the-counter moisturizer gave little relief.",
    "Occupation and hobbies": "No clear occupational exposure identified.",
    "Pregnancy and contraception status": "Pregnant in the second trimester; discuss treatment with the obstetric team and prefer conservative topical care.",
    "Systemic symptoms": "No fever or systemic symptoms.",
    "Focused clue": "The itchy patch enlarged centrifugally; ask about contact sports, pets, shared equipment, and prior topical steroid use.",
    "Household and animal exposures": "A household contact has a similar rash; ask about pets and shared towels or equipment."
  },
  "examFindings": {
    "General appearance": "Fictional teaching patient; assess vital signs and overall appearance in real practice.",
    "Focused lesion exam": "Supplied image is a multi-panel teaching collage labeled for tinea; it includes several anatomic patterns. The fictional case focuses on an annular scaly plaque with a more active outer edge.",
    "Full skin exam": "Assess distribution and extent beyond the pictured site; no fever or systemic symptoms.",
    "Mucosal exam": "No additional abnormality found on this maneuver.",
    "Nails and hair": "No additional abnormality found on this maneuver.",
    "Lymph nodes": "No additional abnormality found on this maneuver.",
    "Nikolsky sign": "No additional abnormality found on this maneuver.",
    "Wood lamp": "No additional abnormality found on this maneuver.",
    "Dermoscopy": "No additional abnormality found on this maneuver."
  },
  "image": {
    "file": "tinea-corporis.jpeg",
    "status": "real",
    "alt": "Independent teaching photograph, not the fictional patient’s record: Supplied image is a multi-panel teaching collage labeled for tinea; it includes several anatomic patterns. The fictional case focuses on an annular scaly plaque with a more active outer edge.",
    "credit": "User-supplied teaching image; permission confirmed by the user."
  },
  "imageStatus": "real",
  "correctMorphology": [
    "Plaque",
    "Scale"
  ],
  "acceptableDifferential": [
    "Tinea corporis",
    "eczema",
    "psoriasis"
  ],
  "tests": [
    {
      "name": "Dermoscopy",
      "result": "No additional abnormality found on this maneuver.",
      "minutes": 4,
      "indicated": false
    },
    {
      "name": "Punch biopsy with H&E",
      "result": "Histopathology supports the hidden diagnosis when properly sampled.",
      "minutes": 18,
      "indicated": false
    },
    {
      "name": "KOH prep",
      "result": "No fungal elements seen.",
      "minutes": 8,
      "indicated": true
    },
    {
      "name": "CBC and CMP",
      "result": "Results should be interpreted with clinical context.",
      "minutes": 12,
      "indicated": false
    },
    {
      "name": "Photo documentation",
      "result": "Baseline clinical photograph recorded with consent.",
      "minutes": 3,
      "indicated": true
    }
  ],
  "acceptableTreatments": [
    {
      "name": "topical antifungal",
      "reason": "confirm with KOH when uncertain; topical antifungal; avoid steroid monotherapy"
    }
  ],
  "unacceptableTreatments": [
    {
      "name": "High-potency topical corticosteroid on face or folds",
      "reason": "Site-related atrophy risk; choose site-appropriate treatment."
    },
    {
      "name": "Systemic corticosteroid for an undifferentiated rash",
      "reason": "May obscure diagnosis and worsen some infections."
    },
    {
      "name": "Methotrexate without baseline assessment",
      "reason": "Requires screening, labs, pregnancy precautions, and specialist oversight."
    },
    {
      "name": "Biologic therapy without infection screening",
      "reason": "Requires appropriate screening and specialist plan."
    },
    {
      "name": "Spironolactone without pregnancy and contraindication review",
      "reason": "Review pregnancy goals, relevant contraindications, and monitoring before use."
    },
    {
      "name": "Isotretinoin without pregnancy prevention steps when applicable",
      "reason": "Major teratogenic risk; follow current prescribing safeguards."
    }
  ],
  "idealDisposition": "discharge",
  "teachingPearl": "An annular plaque with an active scaly border suggests dermatophyte infection; perform KOH scraping when morphology or site is uncertain.",
  "traps": [
    "Anchoring on morphology without asking about timing",
    "Using a potent topical steroid on thin or intertriginous skin",
    "Missing medication timing or mucosal symptoms",
    "Ordering biopsy without a decision-changing question"
  ],
  "needsReview": true,
  "urgentReason": null
}
