{
  "id": "molluscum-contagiosum",
  "category": "common",
  "demographics": {
    "age": 8,
    "sex": "M",
    "pregnancyRelevant": false,
    "context": "pediatric"
  },
  "chiefComplaint": "Several small smooth bumps have appeared on one arm.",
  "lesionSite": "Arm",
  "hiddenDiagnosis": "Molluscum contagiosum",
  "urgency": "routine",
  "historyAnswers": {
    "Onset and duration": "The change began gradually over several weeks.",
    "Itch versus pain": "Usually asymptomatic; mild itch around inflamed lesions.",
    "New medications": "No new medication in the past two months.",
    "Sun exposure and tanning": "Outdoor exposure is intermittent; no tanning bed use.",
    "Personal and family skin cancer history": "No personal skin cancer; family history reviewed.",
    "Immunosuppression": "No known immunosuppression.",
    "Prior treatments": "Over-the-counter moisturizer gave little relief.",
    "Occupation and hobbies": "No clear occupational exposure identified.",
    "Pregnancy and contraception status": "Pregnancy possibility and goals should be reviewed before teratogenic therapies.",
    "Systemic symptoms": "No fever or systemic symptoms.",
    "Focused clue": "The papules have slowly increased over weeks; household or close-contact members may have similar lesions.",
    "Immune status": "Ask about atopic dermatitis and immunosuppression, which can alter extent or appearance."
  },
  "examFindings": {
    "General appearance": "Fictional teaching patient; assess vital signs and overall appearance in real practice.",
    "Focused lesion exam": "Multiple small, smooth, dome-shaped flesh-colored papules with central umbilication, with one larger inflamed papule in the supplied image.",
    "Full skin exam": "Assess distribution and extent beyond the pictured site; no fever or systemic symptoms.",
    "Mucosal exam": "No additional abnormality found on this maneuver.",
    "Nails and hair": "No additional abnormality found on this maneuver.",
    "Lymph nodes": "No additional abnormality found on this maneuver.",
    "Nikolsky sign": "No additional abnormality found on this maneuver.",
    "Wood lamp": "No additional abnormality found on this maneuver.",
    "Dermoscopy": "No additional abnormality found on this maneuver."
  },
  "image": {
    "file": "molluscum-contagiosum.jpg",
    "status": "real",
    "alt": "Independent teaching photograph, not the fictional patient’s record: Multiple small, smooth, dome-shaped flesh-colored papules with central umbilication, with one larger inflamed papule in the supplied image.",
    "credit": "User-supplied teaching image; permission confirmed by the user."
  },
  "imageStatus": "real",
  "correctMorphology": [
    "Papule"
  ],
  "acceptableDifferential": [
    "Molluscum contagiosum",
    "eczema",
    "psoriasis"
  ],
  "tests": [
    {
      "name": "Dermoscopy",
      "result": "No additional abnormality found on this maneuver.",
      "minutes": 4,
      "indicated": false
    },
    {
      "name": "Punch biopsy with H&E",
      "result": "Histopathology supports the hidden diagnosis when properly sampled.",
      "minutes": 18,
      "indicated": false
    },
    {
      "name": "KOH prep",
      "result": "No fungal elements seen.",
      "minutes": 8,
      "indicated": false
    },
    {
      "name": "CBC and CMP",
      "result": "Results should be interpreted with clinical context.",
      "minutes": 12,
      "indicated": false
    },
    {
      "name": "Photo documentation",
      "result": "Baseline clinical photograph recorded with consent.",
      "minutes": 3,
      "indicated": true
    }
  ],
  "acceptableTreatments": [
    {
      "name": "observation + education",
      "reason": "reassurance and observation; discuss autoinoculation and avoid traumatic treatment"
    }
  ],
  "unacceptableTreatments": [
    {
      "name": "High-potency topical corticosteroid on face or folds",
      "reason": "Site-related atrophy risk; choose site-appropriate treatment."
    },
    {
      "name": "Systemic corticosteroid for an undifferentiated rash",
      "reason": "May obscure diagnosis and worsen some infections."
    },
    {
      "name": "Methotrexate without baseline assessment",
      "reason": "Requires screening, labs, pregnancy precautions, and specialist oversight."
    },
    {
      "name": "Biologic therapy without infection screening",
      "reason": "Requires appropriate screening and specialist plan."
    },
    {
      "name": "Spironolactone without pregnancy and contraindication review",
      "reason": "Review pregnancy goals, relevant contraindications, and monitoring before use."
    },
    {
      "name": "Isotretinoin without pregnancy prevention steps when applicable",
      "reason": "Major teratogenic risk; follow current prescribing safeguards."
    }
  ],
  "idealDisposition": "discharge",
  "teachingPearl": "Central umbilication is a useful clue; counsel about transmission and choose watchful waiting or treatment based on symptoms and context.",
  "traps": [
    "Anchoring on morphology without asking about timing",
    "Using a potent topical steroid on thin or intertriginous skin",
    "Missing medication timing or mucosal symptoms",
    "Ordering biopsy without a decision-changing question"
  ],
  "needsReview": true,
  "urgentReason": null
}
