{
  "id": "seborrheic-dermatitis",
  "category": "common",
  "demographics": {
    "age": 46,
    "sex": "M",
    "pregnancyRelevant": false,
    "context": "general"
  },
  "chiefComplaint": "Flaky scale repeatedly returns around the eyebrows and nose.",
  "lesionSite": "Eyebrows and central face",
  "hiddenDiagnosis": "Seborrheic dermatitis",
  "urgency": "routine",
  "historyAnswers": {
    "Onset and duration": "The change began gradually over several weeks.",
    "Itch versus pain": "Mild itch or burning.",
    "New medications": "No new medication in the past two months.",
    "Sun exposure and tanning": "Outdoor exposure is intermittent; no tanning bed use.",
    "Personal and family skin cancer history": "No personal skin cancer; family history reviewed.",
    "Immunosuppression": "No known immunosuppression.",
    "Prior treatments": "Over-the-counter moisturizer gave little relief.",
    "Occupation and hobbies": "No clear occupational exposure identified.",
    "Pregnancy and contraception status": "Pregnancy possibility and goals should be reviewed before teratogenic therapies.",
    "Systemic symptoms": "No fever or systemic symptoms.",
    "Focused clue": "The scale fluctuates and worsens in cold weather; ask about scalp dandruff and prior response to antifungal shampoo.",
    "Immune status": "Ask about immunosuppression or neurologic disease if disease is extensive or unusually severe."
  },
  "examFindings": {
    "General appearance": "Fictional teaching patient; assess vital signs and overall appearance in real practice.",
    "Focused lesion exam": "Fine greasy white-to-yellow scale with mild erythema along the eyebrow and adjacent central facial skin.",
    "Full skin exam": "Assess distribution and extent beyond the pictured site; no fever or systemic symptoms.",
    "Mucosal exam": "No additional abnormality found on this maneuver.",
    "Nails and hair": "No additional abnormality found on this maneuver.",
    "Lymph nodes": "No additional abnormality found on this maneuver.",
    "Nikolsky sign": "No additional abnormality found on this maneuver.",
    "Wood lamp": "No additional abnormality found on this maneuver.",
    "Dermoscopy": "No additional abnormality found on this maneuver."
  },
  "image": {
    "file": "seborrheic-dermatitis.jpg",
    "status": "real",
    "alt": "Independent teaching photograph, not the fictional patient’s record: Fine greasy white-to-yellow scale with mild erythema along the eyebrow and adjacent central facial skin.",
    "credit": "User-supplied teaching image; permission confirmed by the user."
  },
  "imageStatus": "real",
  "correctMorphology": [
    "Scale",
    "Plaque"
  ],
  "acceptableDifferential": [
    "Seborrheic dermatitis",
    "eczema",
    "psoriasis"
  ],
  "tests": [
    {
      "name": "Dermoscopy",
      "result": "No additional abnormality found on this maneuver.",
      "minutes": 4,
      "indicated": false
    },
    {
      "name": "Punch biopsy with H&E",
      "result": "Histopathology supports the hidden diagnosis when properly sampled.",
      "minutes": 18,
      "indicated": false
    },
    {
      "name": "KOH prep",
      "result": "No fungal elements seen.",
      "minutes": 8,
      "indicated": false
    },
    {
      "name": "CBC and CMP",
      "result": "Results should be interpreted with clinical context.",
      "minutes": 12,
      "indicated": false
    },
    {
      "name": "Photo documentation",
      "result": "Baseline clinical photograph recorded with consent.",
      "minutes": 3,
      "indicated": true
    }
  ],
  "acceptableTreatments": [
    {
      "name": "topical antifungal",
      "reason": "topical antifungal and gentle skin care"
    }
  ],
  "unacceptableTreatments": [
    {
      "name": "High-potency topical corticosteroid on face or folds",
      "reason": "Site-related atrophy risk; choose site-appropriate treatment."
    },
    {
      "name": "Systemic corticosteroid for an undifferentiated rash",
      "reason": "May obscure diagnosis and worsen some infections."
    },
    {
      "name": "Methotrexate without baseline assessment",
      "reason": "Requires screening, labs, pregnancy precautions, and specialist oversight."
    },
    {
      "name": "Biologic therapy without infection screening",
      "reason": "Requires appropriate screening and specialist plan."
    },
    {
      "name": "Spironolactone without pregnancy and contraindication review",
      "reason": "Review pregnancy goals, relevant contraindications, and monitoring before use."
    },
    {
      "name": "Isotretinoin without pregnancy prevention steps when applicable",
      "reason": "Major teratogenic risk; follow current prescribing safeguards."
    }
  ],
  "idealDisposition": "discharge",
  "teachingPearl": "Greasy scale in sebaceous areas supports seborrheic dermatitis; distinguish it from psoriasis and contact dermatitis by distribution and course.",
  "traps": [
    "Anchoring on morphology without asking about timing",
    "Using a potent topical steroid on thin or intertriginous skin",
    "Missing medication timing or mucosal symptoms",
    "Ordering biopsy without a decision-changing question"
  ],
  "needsReview": true,
  "urgentReason": null
}
